{
  "media_type": "application/vnd.onchaindiligence.agent-evidence+json",
  "bundle_version": "onchaindiligence.agent-evidence.bundle.v0",
  "envelope": {
    "payloadType": "application/vnd.onchaindiligence.agent-evidence.bundle.v0+json",
    "payload": "eyJidW5kbGVfaWQiOiJzaGEyNTY6R3Rwb01oSUE0LUVDeGdJTHo0ZjBUQTVsY1ptc3F6blZmaDdIVzFHanZicyIsImJ1bmRsZV92ZXJzaW9uIjoib25jaGFpbmRpbGlnZW5jZS5hZ2VudC1ldmlkZW5jZS5idW5kbGUudjAiLCJjcmVhdGVkX2F0IjoiMjAyNi0wOC0yOFQxMjowMDowNi4wMDBaIiwiZXh0ZW5zaW9ucyI6e30sImlzc3VlciI6Imh0dHBzOi8vYXBpLm9uY2hhaW5kaWxpZ2VuY2UuY29tIiwibGltaXRhdGlvbnMiOlsiQnVuZGxlIHZhbGlkaXR5IHByb3ZlcyBjcnlwdG9ncmFwaGljIGludGVncml0eSB1bmRlciB0aGUgQWdlbnQgRXZpZGVuY2UgdjAgdmVyaWZpZXIgY29udHJhY3QuIEl0IGRvZXMgbm90IGJ5IGl0c2VsZiBlc3RhYmxpc2ggYXV0aG9yaXphdGlvbiwgc2FmZXR5LCBzZXR0bGVtZW50LCBkZWxpdmVyeSwgY29tcGxpYW5jZSwgc2VydmljZSBxdWFsaXR5LCBvciBlY29ub21pYyBvdXRjb21lLiIsIlBlci1hcnRpZmFjdCB2ZXJpZmljYXRpb24gaXMgcmVwb3J0ZWQgc2VwYXJhdGVseSBmcm9tIGJ1bmRsZSBpbnRlZ3JpdHk7IGEgdmFsaWQgYnVuZGxlIHNpZ25hdHVyZSBkb2VzIG5vdCBtYWtlIGV2ZXJ5IGVtYmVkZGVkIGFydGlmYWN0IFZBTElELiJdLCJyZWNvbmNpbGlhdGlvbiI6eyJhZ3JlZW1lbnRzIjpbeyJyZWNvcmRfaWRzIjpbInNoYTI1NjpULTBXV1l2aUw4QnpJOUdBNmlweHRLVk43QjlPNVhfWHMwc1cydzI0M3JjIiwic2hhMjU2OnNiTXAtX2Y1NjhjTXNzR2dtSTZZY3BOR0FjYTBuMVpqT2dYaElRb18tZ1EiXSwic3ViamVjdCI6InNhbmN0aW9ucy1zY3JlZW4tYWdyZWVzLXdpdGgtYWxsb3dhbmNlLXByZWZsaWdodC1wb2xpY3kiLCJzdW1tYXJ5IjoiVGhlIHNhbmN0aW9ucyBzY3JlZW4gZm91bmQgbm8gbWF0Y2ggZm9yIHRoZSBjb3VudGVycGFydHksIGFuZCB0aGUgYWxsb3dhbmNlIHByZWZsaWdodCBpbmRlcGVuZGVudGx5IHJlYWNoZWQgQUxMT1cgdW5kZXIgaXRzIG93biBwb2xpY3kgLS0gYm90aCBjaGVja3MgYWdyZWUgdGhlIHByb3Bvc2VkIGFjdGlvbiBpcyBub3QgYmxvY2tlZCBieSBlaXRoZXIgZXZpZGVuY2Ugc291cmNlLiJ9XSwiY29udHJhZGljdGlvbnMiOltdLCJpbnN1ZmZpY2llbnRfZXZpZGVuY2UiOlt7InJlY29yZF9pZHMiOltdLCJzdWJqZWN0Ijoic2V0dGxlbWVudC1jb25maXJtYXRpb24iLCJzdW1tYXJ5IjoiVGhpcyBidW5kbGUgY29udGFpbnMgYSBQUkVGTElHSFQgcmVjZWlwdCBvbmx5OyBubyBleGVjdXRpb24gb3Igc2V0dGxlbWVudCByZWNvcmQgaXMgcHJlc2VudCwgc28gd2hldGhlciB0aGUgYWxsb3dhbmNlIGFjdGlvbiB3YXMgZXZlciBzdWJtaXR0ZWQgb3Igc2V0dGxlZCBpcyBub3QgZXN0YWJsaXNoZWQgb25lIHdheSBvciB0aGUgb3RoZXIuIn1dfSwicmVjb3JkcyI6W3siaWQiOiJzaGEyNTY6SEpnaFRfeEhLYUM1YlNfNUg2cFhiOVNIVlJtc2ExeGVYbzJ1dnBUVUZxZyIsImtpbmQiOiJwcmluY2lwYWwiLCJwYXJlbnRzIjpbXSwicHJvb2ZzIjpbXSwicmVjb3JkX3ZlcnNpb24iOiJvbmNoYWluZGlsaWdlbmNlLmFnZW50LWV2aWRlbmNlLnJlY29yZC52MCIsInN0YXRlbWVudCI6eyJkaXNwbGF5X25hbWUiOiJDb25mb3JtYW5jZSBUcmVhc3VyeSIsInByaW5jaXBhbF9pZCI6InVybjpvbmNoYWluZGlsaWdlbmNlOnRlc3Q6dHJlYXN1cnkiLCJwcmluY2lwYWxfdHlwZSI6Im9yZ2FuaXphdGlvbiJ9fSx7ImlkIjoic2hhMjU2Ok8xemhJMUpxRGNtZUtPaFN3UlpUMjBhN2lFQzcxamxINi0wUVdiUl9DNTQiLCJraW5kIjoiYWdlbnQiLCJwYXJlbnRzIjpbInNoYTI1NjpISmdoVF94SEthQzViU181SDZwWGI5U0hWUm1zYTF4ZVhvMnV2cFRVRnFnIl0sInByb29mcyI6W10sInJlY29yZF92ZXJzaW9uIjoib25jaGFpbmRpbGlnZW5jZS5hZ2VudC1ldmlkZW5jZS5yZWNvcmQudjAiLCJzdGF0ZW1lbnQiOnsiYWdlbnRfaWQiOiJ1cm46b25jaGFpbmRpbGlnZW5jZTp0ZXN0OmFnZW50IiwiYWdlbnRfdmVyc2lvbiI6IjEuMC4wIiwib3BlcmF0b3JfcmVmIjoic2hhMjU2OkhKZ2hUX3hIS2FDNWJTXzVINnBYYjlTSFZSbXNhMXhlWG8ydXZwVFVGcWcifX0seyJpZCI6InNoYTI1NjpULTBXV1l2aUw4QnpJOUdBNmlweHRLVk43QjlPNVhfWHMwc1cydzI0M3JjIiwia2luZCI6ImV2aWRlbmNlIiwicGFyZW50cyI6WyJzaGEyNTY6aFdOS2xLNFlpQlBvUlRKRTlTRGU0aWRuZjZsR1Bhd1FJcmxvamFlaVNoNCJdLCJwcm9vZnMiOlt7ImVudmVsb3BlIjp7ImF0dGVzdGF0aW9uIjp7ImFsZ29yaXRobSI6ImVkMjU1MTkiLCJjYW5vbmljYWxpemF0aW9uIjoiUkZDODc4NSIsImlzc3VlZF9hdCI6IjIwMjYtMDgtMjhUMTI6MDA6MDIuMDAwWiIsImlzc3VlciI6Imh0dHBzOi8vYXBpLm9uY2hhaW5kaWxpZ2VuY2UuY29tIiwia2V5X2lkIjoiZWQyNTUxOS0zckxlMDUzQ2I4NE9ZSVcyIiwicHVycG9zZSI6ImNvbXBsaWFuY2Utc2NyZWVuaW5nLXJlc3VsdCIsInNjaGVtYV92ZXJzaW9uIjoib25jaGFpbmRpbGlnZW5jZS5hdHRlc3RhdGlvbi52MiIsInNpZ25hdHVyZSI6ImR2dkxSYlhXLWNyVzYtdVRMbnliYW9fNGxfb0FKX2prdWFrRXhCaXZTV2d0d0szcTlOQzg4ZjNyOWtTeEdlVnhHdVkzM0k2RUY2dFBYZWU0LXFYWkRnIiwic2lnbmVkIjp0cnVlfSwiZGF0YSI6eyJhZGRyZXNzIjoiMHgwMDAwMDAwMDAwMDAwMDAwMDAwMDAwMDAwMDAwMDAwMDAwMDAwMDAyIiwic2FuY3Rpb25lZCI6ZmFsc2V9fSwicHJvb2ZfdHlwZSI6Im9uY2hhaW5kaWxpZ2VuY2UtYXR0ZXN0YXRpb24tdjIifV0sInJlY29yZF92ZXJzaW9uIjoib25jaGFpbmRpbGlnZW5jZS5hZ2VudC1ldmlkZW5jZS5yZWNvcmQudjAiLCJzdGF0ZW1lbnQiOnsiZXZpZGVuY2VfdHlwZSI6InNhbmN0aW9ucy1zY3JlZW4iLCJleHBpcmVzX2F0IjpudWxsLCJvYnNlcnZlZF9hdCI6IjIwMjYtMDgtMjhUMTI6MDA6MDIuMDAwWiIsInJlcXVlc3QiOnsiZGlnZXN0Ijp7InNoYTI1NiI6IlJfZS1JZl9TYmNGMW9JRFJqNXJNQ21MRzhPbmV0NkhaYnJpUFZqbWZwQ00ifSwibWVkaWFfdHlwZSI6ImFwcGxpY2F0aW9uL2pzb24ifSwicmVzcG9uc2UiOnsiZGlnZXN0Ijp7InNoYTI1NiI6IldWeTlCSERCY3phU3F3Vl9Icmc3WkV4QnFEekVqME91WmszUDk2dk8zVEUifSwibWVkaWFfdHlwZSI6ImFwcGxpY2F0aW9uL2pzb24iLCJtb2RlIjoiZW1iZWRkZWQiLCJ2YWx1ZSI6eyJhdHRlc3RhdGlvbiI6eyJhbGdvcml0aG0iOiJlZDI1NTE5IiwiY2Fub25pY2FsaXphdGlvbiI6IlJGQzg3ODUiLCJpc3N1ZWRfYXQiOiIyMDI2LTA4LTI4VDEyOjAwOjAyLjAwMFoiLCJpc3N1ZXIiOiJodHRwczovL2FwaS5vbmNoYWluZGlsaWdlbmNlLmNvbSIsImtleV9pZCI6ImVkMjU1MTktM3JMZTA1M0NiODRPWUlXMiIsInB1cnBvc2UiOiJjb21wbGlhbmNlLXNjcmVlbmluZy1yZXN1bHQiLCJzY2hlbWFfdmVyc2lvbiI6Im9uY2hhaW5kaWxpZ2VuY2UuYXR0ZXN0YXRpb24udjIiLCJzaWduYXR1cmUiOiJkdnZMUmJYVy1jclc2LXVUTG55YmFvXzRsX29BSl9qa3Vha0V4Qml2U1dndHdLM3E5TkM4OGYzcjlrU3hHZVZ4R3VZMzNJNkVGNnRQWGVlNC1xWFpEZyIsInNpZ25lZCI6dHJ1ZX0sImRhdGEiOnsiYWRkcmVzcyI6IjB4MDAwMDAwMDAwMDAwMDAwMDAwMDAwMDAwMDAwMDAwMDAwMDAwMDAwMiIsInNhbmN0aW9uZWQiOmZhbHNlfX19LCJydW5fcmVmIjoic2hhMjU2OmhXTktsSzRZaUJQb1JUSkU5U0RlNGlkbmY2bEdQYXdRSXJsb2phZWlTaDQiLCJzY29wZSI6eyJjb3ZlcmFnZSI6Im9uZSB0ZXN0IGFkZHJlc3MiLCJxdWVyeSI6IjB4MDAwMDAwMDAwMDAwMDAwMDAwMDAwMDAwMDAwMDAwMDAwMDAwMDAwMiJ9LCJzb3VyY2UiOnsiaWQiOiJodHRwczovL2FwaS5vbmNoYWluZGlsaWdlbmNlLmNvbSIsInR5cGUiOiJodHRwcy1hcGkifSwidG9vbCI6eyJuYW1lIjoic2NyZWVuX3dhbGxldCIsInZlcnNpb24iOiIxIn0sInRydXN0X21vZGUiOiJwdWJsaXNoZXItc2lnbmVkIn19LHsiaWQiOiJzaGEyNTY6aFdOS2xLNFlpQlBvUlRKRTlTRGU0aWRuZjZsR1Bhd1FJcmxvamFlaVNoNCIsImtpbmQiOiJydW4iLCJwYXJlbnRzIjpbInNoYTI1NjpPMXpoSTFKcURjbWVLT2hTd1JaVDIwYTdpRUM3MWpsSDYtMFFXYlJfQzU0Iiwic2hhMjU2Om12bUg5TWRpeTRDdlZSU2RXclIyUVFRejlPYWVnNDhpdlVMR2RxVjBxU3MiXSwicHJvb2ZzIjpbXSwicmVjb3JkX3ZlcnNpb24iOiJvbmNoYWluZGlsaWdlbmNlLmFnZW50LWV2aWRlbmNlLnJlY29yZC52MCIsInN0YXRlbWVudCI6eyJhZ2VudF9yZWYiOiJzaGEyNTY6TzF6aEkxSnFEY21lS09oU3dSWlQyMGE3aUVDNzFqbEg2LTBRV2JSX0M1NCIsImVuZGVkX2F0IjoiMjAyNi0wOC0yOFQxMjowMDowNS4wMDBaIiwibWFuZGF0ZV9yZWYiOiJzaGEyNTY6bXZtSDlNZGl5NEN2VlJTZFdyUjJRUVF6OU9hZWc0OGl2VUxHZHFWMHFTcyIsInJ1bl9leHRlcm5hbF9pZCI6InJ1bi1jb25mb3JtYW5jZS0wMDEiLCJzdGFydGVkX2F0IjoiMjAyNi0wOC0yOFQxMjowMDowMC4wMDBaIn19LHsiaWQiOiJzaGEyNTY6bXZtSDlNZGl5NEN2VlJTZFdyUjJRUVF6OU9hZWc0OGl2VUxHZHFWMHFTcyIsImtpbmQiOiJtYW5kYXRlIiwicGFyZW50cyI6WyJzaGEyNTY6SEpnaFRfeEhLYUM1YlNfNUg2cFhiOVNIVlJtc2ExeGVYbzJ1dnBUVUZxZyJdLCJwcm9vZnMiOltdLCJyZWNvcmRfdmVyc2lvbiI6Im9uY2hhaW5kaWxpZ2VuY2UuYWdlbnQtZXZpZGVuY2UucmVjb3JkLnYwIiwic3RhdGVtZW50Ijp7ImxpbWl0cyI6eyJhbW91bnQiOiIxMC4wMCJ9LCJtYW5kYXRlX2lkIjoibWFuZGF0ZS1jb25mb3JtYW5jZS0wMDEiLCJwcmluY2lwYWxfcmVmIjoic2hhMjU2OkhKZ2hUX3hIS2FDNWJTXzVINnBYYjlTSFZSbXNhMXhlWG8ydXZwVFVGcWciLCJzY29wZSI6eyJhY3Rpb24iOiJwYXkiLCJhc3NldCI6InBhdGhVU0QiLCJtYXhfYW1vdW50IjoiMTAuMDAifSwidmFsaWRfZnJvbSI6IjIwMjYtMDgtMjhUMDA6MDA6MDAuMDAwWiIsInZhbGlkX3VudGlsIjoiMjAyNi0wOC0yOVQwMDowMDowMC4wMDBaIn19XSwicm9vdF9pZHMiOlsic2hhMjU2OlQtMFdXWXZpTDhCekk5R0E2aXB4dEtWTjdCOU81WF9YczBzVzJ3MjQzcmMiLCJzaGEyNTY6c2JNcC1fZjU2OGNNc3NHZ21JNlljcE5HQWNhMG4xWmpPZ1hoSVFvXy1nUSJdLCJydW5faWQiOiJzaGEyNTY6aFdOS2xLNFlpQlBvUlRKRTlTRGU0aWRuZjZsR1Bhd1FJcmxvamFlaVNoNCJ9",
    "signatures": [
      {
        "keyid": "ed25519-3rLe053Cb84OYIW2",
        "sig": "WElF25jOCyrdZCPp+BkLiM9+E+pjlpk4ucL6W0IE82WG0KJOBJ/mcV4k7BNn9NiAy2cjUzhvWNyJ4HzxCt6sBg=="
      }
    ]
  },
  "verification_material": {
    "keys": [
      {
        "key_id": "ed25519-3rLe053Cb84OYIW2",
        "algorithm": "ed25519",
        "public_key_pem": "-----BEGIN PUBLIC KEY-----\nMCowBQYDK2VwAyEAPUAXw+hDiVqStwqnTRt+vJyYLM8uxJaMwM1V8Sr0Zgw=\n-----END PUBLIC KEY-----\n",
        "status": "active",
        "valid_from": "2026-08-28T00:00:00.000Z",
        "valid_until": null,
        "status_changed_at": "2026-08-28T00:00:00.000Z",
        "replacement_key_id": null,
        "compromised_at": null
      }
    ],
    "registry_snapshots": [],
    "anchors": []
  }
}
