{
  "media_type": "application/vnd.onchaindiligence.agent-evidence+json",
  "bundle_version": "onchaindiligence.agent-evidence.bundle.v0",
  "envelope": {
    "payloadType": "application/vnd.onchaindiligence.agent-evidence.bundle.v0+json",
    "payload": "eyJidW5kbGVfaWQiOiJzaGEyNTY6OFBlZHZnUDcwR2VVbzlqUkszTmo4NTdXeDlZVUhKb0JNcjlmOXpQMVRaTSIsImJ1bmRsZV92ZXJzaW9uIjoib25jaGFpbmRpbGlnZW5jZS5hZ2VudC1ldmlkZW5jZS5idW5kbGUudjAiLCJjcmVhdGVkX2F0IjoiMjAyNi0wOC0yOFQxMjowMDowNi4wMDBaIiwiZXh0ZW5zaW9ucyI6e30sImlzc3VlciI6Imh0dHBzOi8vYXBpLm9uY2hhaW5kaWxpZ2VuY2UuY29tIiwibGltaXRhdGlvbnMiOlsiQnVuZGxlIHZhbGlkaXR5IHByb3ZlcyBjcnlwdG9ncmFwaGljIGludGVncml0eSB1bmRlciB0aGUgQWdlbnQgRXZpZGVuY2UgdjAgdmVyaWZpZXIgY29udHJhY3QuIEl0IGRvZXMgbm90IGJ5IGl0c2VsZiBlc3RhYmxpc2ggYXV0aG9yaXphdGlvbiwgc2FmZXR5LCBzZXR0bGVtZW50LCBkZWxpdmVyeSwgY29tcGxpYW5jZSwgc2VydmljZSBxdWFsaXR5LCBvciBlY29ub21pYyBvdXRjb21lLiIsIlBlci1hcnRpZmFjdCB2ZXJpZmljYXRpb24gaXMgcmVwb3J0ZWQgc2VwYXJhdGVseSBmcm9tIGJ1bmRsZSBpbnRlZ3JpdHk7IGEgdmFsaWQgYnVuZGxlIHNpZ25hdHVyZSBkb2VzIG5vdCBtYWtlIGV2ZXJ5IGVtYmVkZGVkIGFydGlmYWN0IFZBTElELiJdLCJyZWNvbmNpbGlhdGlvbiI6eyJhZ3JlZW1lbnRzIjpbXSwiY29udHJhZGljdGlvbnMiOltdLCJpbnN1ZmZpY2llbnRfZXZpZGVuY2UiOlt7InJlY29yZF9pZHMiOltdLCJzdWJqZWN0Ijoic2V0dGxlbWVudC1jb25maXJtYXRpb24iLCJzdW1tYXJ5IjoiVGhpcyBidW5kbGUgY29udGFpbnMgYSBQUkVGTElHSFQgcmVjZWlwdCBvbmx5OyBubyBleGVjdXRpb24gb3Igc2V0dGxlbWVudCByZWNvcmQgaXMgcHJlc2VudCwgc28gd2hldGhlciB0aGUgYWxsb3dhbmNlIGFjdGlvbiB3YXMgZXZlciBzdWJtaXR0ZWQgb3Igc2V0dGxlZCBpcyBub3QgZXN0YWJsaXNoZWQgb25lIHdheSBvciB0aGUgb3RoZXIuIn1dfSwicmVjb3JkcyI6W3siaWQiOiJzaGEyNTY6MnBHMDNKTWNtaGo3NkREX0laN3MxUktGQWZyVm13eGNHVUg4aDJ1SVhNMCIsImtpbmQiOiJldmlkZW5jZSIsInBhcmVudHMiOlsic2hhMjU2OmhXTktsSzRZaUJQb1JUSkU5U0RlNGlkbmY2bEdQYXdRSXJsb2phZWlTaDQiXSwicHJvb2ZzIjpbeyJkaWdlc3QiOnsic2hhMjU2IjoiQmFKV0pHWlJ1a1ZiSW1PUG1tbjAwMlBvTUgwRDBBZmVKS3ZON2hUamdPWSJ9LCJtZWRpYV90eXBlIjoib25jaGFpbmRpbGlnZW5jZS5zb21lLWZ1dHVyZS1hY3Rpb24udjkiLCJwcm9vZl90eXBlIjoiZXh0ZXJuYWwtZGlnZXN0In1dLCJyZWNvcmRfdmVyc2lvbiI6Im9uY2hhaW5kaWxpZ2VuY2UuYWdlbnQtZXZpZGVuY2UucmVjb3JkLnYwIiwic3RhdGVtZW50Ijp7ImV2aWRlbmNlX3R5cGUiOiJvbmNoYWluZGlsaWdlbmNlLnNvbWUtZnV0dXJlLWFjdGlvbi52OSIsImV4cGlyZXNfYXQiOm51bGwsIm9ic2VydmVkX2F0IjoiMjAyNi0wOC0yOFQxMjowMDowNC4wMDBaIiwicmVxdWVzdCI6eyJkaWdlc3QiOnsic2hhMjU2IjoiUkJOdm8xV3paNG9SUnEwVzktaGtucFQ3VDhJZjUzNkRFTUJnOWh5cV80byJ9LCJtZWRpYV90eXBlIjoiYXBwbGljYXRpb24vanNvbiJ9LCJyZXNwb25zZSI6eyJkaWdlc3QiOnsic2hhMjU2IjoiQmFKV0pHWlJ1a1ZiSW1PUG1tbjAwMlBvTUgwRDBBZmVKS3ZON2hUamdPWSJ9LCJtZWRpYV90eXBlIjoiYXBwbGljYXRpb24vanNvbiIsIm1vZGUiOiJlbWJlZGRlZCIsInZhbHVlIjp7ImRhdGEiOnsibm90ZSI6ImEgZmFtaWx5IHRoaXMgdmVyaWZpZXIgaGFzIG5ldmVyIGhlYXJkIG9mIn0sInNjaGVtYSI6Im9uY2hhaW5kaWxpZ2VuY2Uuc29tZS1mdXR1cmUtYWN0aW9uLnY5In19LCJydW5fcmVmIjoic2hhMjU2OmhXTktsSzRZaUJQb1JUSkU5U0RlNGlkbmY2bEdQYXdRSXJsb2phZWlTaDQiLCJzY29wZSI6eyJjb3ZlcmFnZSI6InVucmVjb2duaXplZCBhcnRpZmFjdCBmYW1pbHksIGluY2x1ZGVkIHRvIGV4ZXJjaXNlIHVua25vd24tdHlwZSBoYW5kbGluZyIsInF1ZXJ5Ijoibi9hIn0sInNvdXJjZSI6eyJpZCI6InVybjpvbmNoYWluZGlsaWdlbmNlOnRlc3Q6ZnV0dXJlLXRvb2wiLCJ0eXBlIjoidW5rbm93biJ9LCJ0b29sIjp7Im5hbWUiOiJmdXR1cmVfdG9vbCIsInZlcnNpb24iOiI5In0sInRydXN0X21vZGUiOiJhZ2VudC1hc3NlcnRpb24ifX0seyJpZCI6InNoYTI1NjpISmdoVF94SEthQzViU181SDZwWGI5U0hWUm1zYTF4ZVhvMnV2cFRVRnFnIiwia2luZCI6InByaW5jaXBhbCIsInBhcmVudHMiOltdLCJwcm9vZnMiOltdLCJyZWNvcmRfdmVyc2lvbiI6Im9uY2hhaW5kaWxpZ2VuY2UuYWdlbnQtZXZpZGVuY2UucmVjb3JkLnYwIiwic3RhdGVtZW50Ijp7ImRpc3BsYXlfbmFtZSI6IkNvbmZvcm1hbmNlIFRyZWFzdXJ5IiwicHJpbmNpcGFsX2lkIjoidXJuOm9uY2hhaW5kaWxpZ2VuY2U6dGVzdDp0cmVhc3VyeSIsInByaW5jaXBhbF90eXBlIjoib3JnYW5pemF0aW9uIn19LHsiaWQiOiJzaGEyNTY6TzF6aEkxSnFEY21lS09oU3dSWlQyMGE3aUVDNzFqbEg2LTBRV2JSX0M1NCIsImtpbmQiOiJhZ2VudCIsInBhcmVudHMiOlsic2hhMjU2OkhKZ2hUX3hIS2FDNWJTXzVINnBYYjlTSFZSbXNhMXhlWG8ydXZwVFVGcWciXSwicHJvb2ZzIjpbXSwicmVjb3JkX3ZlcnNpb24iOiJvbmNoYWluZGlsaWdlbmNlLmFnZW50LWV2aWRlbmNlLnJlY29yZC52MCIsInN0YXRlbWVudCI6eyJhZ2VudF9pZCI6InVybjpvbmNoYWluZGlsaWdlbmNlOnRlc3Q6YWdlbnQiLCJhZ2VudF92ZXJzaW9uIjoiMS4wLjAiLCJvcGVyYXRvcl9yZWYiOiJzaGEyNTY6SEpnaFRfeEhLYUM1YlNfNUg2cFhiOVNIVlJtc2ExeGVYbzJ1dnBUVUZxZyJ9fSx7ImlkIjoic2hhMjU2OlQtMFdXWXZpTDhCekk5R0E2aXB4dEtWTjdCOU81WF9YczBzVzJ3MjQzcmMiLCJraW5kIjoiZXZpZGVuY2UiLCJwYXJlbnRzIjpbInNoYTI1NjpoV05LbEs0WWlCUG9SVEpFOVNEZTRpZG5mNmxHUGF3UUlybG9qYWVpU2g0Il0sInByb29mcyI6W3siZW52ZWxvcGUiOnsiYXR0ZXN0YXRpb24iOnsiYWxnb3JpdGhtIjoiZWQyNTUxOSIsImNhbm9uaWNhbGl6YXRpb24iOiJSRkM4Nzg1IiwiaXNzdWVkX2F0IjoiMjAyNi0wOC0yOFQxMjowMDowMi4wMDBaIiwiaXNzdWVyIjoiaHR0cHM6Ly9hcGkub25jaGFpbmRpbGlnZW5jZS5jb20iLCJrZXlfaWQiOiJlZDI1NTE5LTNyTGUwNTNDYjg0T1lJVzIiLCJwdXJwb3NlIjoiY29tcGxpYW5jZS1zY3JlZW5pbmctcmVzdWx0Iiwic2NoZW1hX3ZlcnNpb24iOiJvbmNoYWluZGlsaWdlbmNlLmF0dGVzdGF0aW9uLnYyIiwic2lnbmF0dXJlIjoiZHZ2TFJiWFctY3JXNi11VExueWJhb180bF9vQUpfamt1YWtFeEJpdlNXZ3R3SzNxOU5DODhmM3I5a1N4R2VWeEd1WTMzSTZFRjZ0UFhlZTQtcVhaRGciLCJzaWduZWQiOnRydWV9LCJkYXRhIjp7ImFkZHJlc3MiOiIweDAwMDAwMDAwMDAwMDAwMDAwMDAwMDAwMDAwMDAwMDAwMDAwMDAwMDIiLCJzYW5jdGlvbmVkIjpmYWxzZX19LCJwcm9vZl90eXBlIjoib25jaGFpbmRpbGlnZW5jZS1hdHRlc3RhdGlvbi12MiJ9XSwicmVjb3JkX3ZlcnNpb24iOiJvbmNoYWluZGlsaWdlbmNlLmFnZW50LWV2aWRlbmNlLnJlY29yZC52MCIsInN0YXRlbWVudCI6eyJldmlkZW5jZV90eXBlIjoic2FuY3Rpb25zLXNjcmVlbiIsImV4cGlyZXNfYXQiOm51bGwsIm9ic2VydmVkX2F0IjoiMjAyNi0wOC0yOFQxMjowMDowMi4wMDBaIiwicmVxdWVzdCI6eyJkaWdlc3QiOnsic2hhMjU2IjoiUl9lLUlmX1NiY0Yxb0lEUmo1ck1DbUxHOE9uZXQ2SFpicmlQVmptZnBDTSJ9LCJtZWRpYV90eXBlIjoiYXBwbGljYXRpb24vanNvbiJ9LCJyZXNwb25zZSI6eyJkaWdlc3QiOnsic2hhMjU2IjoiV1Z5OUJIREJjemFTcXdWX0hyZzdaRXhCcUR6RWowT3VaazNQOTZ2TzNURSJ9LCJtZWRpYV90eXBlIjoiYXBwbGljYXRpb24vanNvbiIsIm1vZGUiOiJlbWJlZGRlZCIsInZhbHVlIjp7ImF0dGVzdGF0aW9uIjp7ImFsZ29yaXRobSI6ImVkMjU1MTkiLCJjYW5vbmljYWxpemF0aW9uIjoiUkZDODc4NSIsImlzc3VlZF9hdCI6IjIwMjYtMDgtMjhUMTI6MDA6MDIuMDAwWiIsImlzc3VlciI6Imh0dHBzOi8vYXBpLm9uY2hhaW5kaWxpZ2VuY2UuY29tIiwia2V5X2lkIjoiZWQyNTUxOS0zckxlMDUzQ2I4NE9ZSVcyIiwicHVycG9zZSI6ImNvbXBsaWFuY2Utc2NyZWVuaW5nLXJlc3VsdCIsInNjaGVtYV92ZXJzaW9uIjoib25jaGFpbmRpbGlnZW5jZS5hdHRlc3RhdGlvbi52MiIsInNpZ25hdHVyZSI6ImR2dkxSYlhXLWNyVzYtdVRMbnliYW9fNGxfb0FKX2prdWFrRXhCaXZTV2d0d0szcTlOQzg4ZjNyOWtTeEdlVnhHdVkzM0k2RUY2dFBYZWU0LXFYWkRnIiwic2lnbmVkIjp0cnVlfSwiZGF0YSI6eyJhZGRyZXNzIjoiMHgwMDAwMDAwMDAwMDAwMDAwMDAwMDAwMDAwMDAwMDAwMDAwMDAwMDAyIiwic2FuY3Rpb25lZCI6ZmFsc2V9fX0sInJ1bl9yZWYiOiJzaGEyNTY6aFdOS2xLNFlpQlBvUlRKRTlTRGU0aWRuZjZsR1Bhd1FJcmxvamFlaVNoNCIsInNjb3BlIjp7ImNvdmVyYWdlIjoib25lIHRlc3QgYWRkcmVzcyIsInF1ZXJ5IjoiMHgwMDAwMDAwMDAwMDAwMDAwMDAwMDAwMDAwMDAwMDAwMDAwMDAwMDAyIn0sInNvdXJjZSI6eyJpZCI6Imh0dHBzOi8vYXBpLm9uY2hhaW5kaWxpZ2VuY2UuY29tIiwidHlwZSI6Imh0dHBzLWFwaSJ9LCJ0b29sIjp7Im5hbWUiOiJzY3JlZW5fd2FsbGV0IiwidmVyc2lvbiI6IjEifSwidHJ1c3RfbW9kZSI6InB1Ymxpc2hlci1zaWduZWQifX0seyJpZCI6InNoYTI1NjpoV05LbEs0WWlCUG9SVEpFOVNEZTRpZG5mNmxHUGF3UUlybG9qYWVpU2g0Iiwia2luZCI6InJ1biIsInBhcmVudHMiOlsic2hhMjU2Ok8xemhJMUpxRGNtZUtPaFN3UlpUMjBhN2lFQzcxamxINi0wUVdiUl9DNTQiLCJzaGEyNTY6bXZtSDlNZGl5NEN2VlJTZFdyUjJRUVF6OU9hZWc0OGl2VUxHZHFWMHFTcyJdLCJwcm9vZnMiOltdLCJyZWNvcmRfdmVyc2lvbiI6Im9uY2hhaW5kaWxpZ2VuY2UuYWdlbnQtZXZpZGVuY2UucmVjb3JkLnYwIiwic3RhdGVtZW50Ijp7ImFnZW50X3JlZiI6InNoYTI1NjpPMXpoSTFKcURjbWVLT2hTd1JaVDIwYTdpRUM3MWpsSDYtMFFXYlJfQzU0IiwiZW5kZWRfYXQiOiIyMDI2LTA4LTI4VDEyOjAwOjA1LjAwMFoiLCJtYW5kYXRlX3JlZiI6InNoYTI1Njptdm1IOU1kaXk0Q3ZWUlNkV3JSMlFRUXo5T2FlZzQ4aXZVTEdkcVYwcVNzIiwicnVuX2V4dGVybmFsX2lkIjoicnVuLWNvbmZvcm1hbmNlLTAwMSIsInN0YXJ0ZWRfYXQiOiIyMDI2LTA4LTI4VDEyOjAwOjAwLjAwMFoifX0seyJpZCI6InNoYTI1Njptdm1IOU1kaXk0Q3ZWUlNkV3JSMlFRUXo5T2FlZzQ4aXZVTEdkcVYwcVNzIiwia2luZCI6Im1hbmRhdGUiLCJwYXJlbnRzIjpbInNoYTI1NjpISmdoVF94SEthQzViU181SDZwWGI5U0hWUm1zYTF4ZVhvMnV2cFRVRnFnIl0sInByb29mcyI6W10sInJlY29yZF92ZXJzaW9uIjoib25jaGFpbmRpbGlnZW5jZS5hZ2VudC1ldmlkZW5jZS5yZWNvcmQudjAiLCJzdGF0ZW1lbnQiOnsibGltaXRzIjp7ImFtb3VudCI6IjEwLjAwIn0sIm1hbmRhdGVfaWQiOiJtYW5kYXRlLWNvbmZvcm1hbmNlLTAwMSIsInByaW5jaXBhbF9yZWYiOiJzaGEyNTY6SEpnaFRfeEhLYUM1YlNfNUg2cFhiOVNIVlJtc2ExeGVYbzJ1dnBUVUZxZyIsInNjb3BlIjp7ImFjdGlvbiI6InBheSIsImFzc2V0IjoicGF0aFVTRCIsIm1heF9hbW91bnQiOiIxMC4wMCJ9LCJ2YWxpZF9mcm9tIjoiMjAyNi0wOC0yOFQwMDowMDowMC4wMDBaIiwidmFsaWRfdW50aWwiOiIyMDI2LTA4LTI5VDAwOjAwOjAwLjAwMFoifX1dLCJyb290X2lkcyI6WyJzaGEyNTY6MnBHMDNKTWNtaGo3NkREX0laN3MxUktGQWZyVm13eGNHVUg4aDJ1SVhNMCIsInNoYTI1NjpULTBXV1l2aUw4QnpJOUdBNmlweHRLVk43QjlPNVhfWHMwc1cydzI0M3JjIl0sInJ1bl9pZCI6InNoYTI1NjpoV05LbEs0WWlCUG9SVEpFOVNEZTRpZG5mNmxHUGF3UUlybG9qYWVpU2g0In0=",
    "signatures": [
      {
        "keyid": "ed25519-3rLe053Cb84OYIW2",
        "sig": "KNg7bEA26G3T2nacONuqDViwjvs8PO8CvUcrXdNX0Gopp3IoiTtcZyRDS+6rBfZECnO+V0e/pxOOQllwAt1GDw=="
      }
    ]
  },
  "verification_material": {
    "keys": [
      {
        "key_id": "ed25519-3rLe053Cb84OYIW2",
        "algorithm": "ed25519",
        "public_key_pem": "-----BEGIN PUBLIC KEY-----\nMCowBQYDK2VwAyEAPUAXw+hDiVqStwqnTRt+vJyYLM8uxJaMwM1V8Sr0Zgw=\n-----END PUBLIC KEY-----\n",
        "status": "active",
        "valid_from": "2026-08-28T00:00:00.000Z",
        "valid_until": null,
        "status_changed_at": "2026-08-28T00:00:00.000Z",
        "replacement_key_id": null,
        "compromised_at": null
      }
    ],
    "registry_snapshots": [],
    "anchors": []
  }
}
