{
  "media_type": "application/vnd.onchaindiligence.agent-evidence+json",
  "bundle_version": "onchaindiligence.agent-evidence.bundle.v0",
  "envelope": {
    "payloadType": "application/vnd.onchaindiligence.agent-evidence.bundle.v0+json",
    "payload": "eyJidW5kbGVfaWQiOiJzaGEyNTY6ZXpweWczM05SQWNTWllrekpnMzJsX0dURlBNUzdGNnBoMVJ3VzFxZXNtbyIsImJ1bmRsZV92ZXJzaW9uIjoib25jaGFpbmRpbGlnZW5jZS5hZ2VudC1ldmlkZW5jZS5idW5kbGUudjAiLCJjcmVhdGVkX2F0IjoiMjAyNi0wOC0yOFQxMjowMDowNi4wMDBaIiwiZXh0ZW5zaW9ucyI6e30sInJlY29yZHMiOlt7ImlkIjoic2hhMjU2Oi12NVM2Qmg0OFdVNmpDY2hzOFFlOThpdmZfQV9wZEVJR3RtY3hmTThveEkiLCJraW5kIjoiZXhlY3V0aW9uIiwicGFyZW50cyI6WyJzaGEyNTY6Rkx5WVZncWNGTzIxN0JQWDJUMXVpcUpMT2dNaU1OODc5YXZUN3ZLQzhyayJdLCJwcm9vZnMiOltdLCJyZWNvcmRfdmVyc2lvbiI6Im9uY2hhaW5kaWxpZ2VuY2UuYWdlbnQtZXZpZGVuY2UucmVjb3JkLnYwIiwic3RhdGVtZW50Ijp7ImFtb3VudCI6IjEuMDAiLCJhc3NldCI6InBhdGhVU0QiLCJibG9ja19udW1iZXIiOiIxMjM0NTY3OCIsImNvbmZpcm1lZF9hdCI6IjIwMjYtMDgtMjhUMTI6MDA6MDUuMDAwWiIsImRlY2lzaW9uX3JlZiI6InNoYTI1NjpGTHlZVmdxY0ZPMjE3QlBYMlQxdWlxSkxPZ01pTU44NzlhdlQ3dktDOHJrIiwiZXhlY3V0aW9uX2lkIjoiZXhlY3V0aW9uLWNvbmZvcm1hbmNlLTAwMSIsImV4ZWN1dGlvbl90eXBlIjoib25jaGFpbi10cmFuc2ZlciIsIm5ldHdvcmsiOiJlaXAxNTU6MSIsInJlY2lwaWVudCI6IjB4MjIyMjIyMjIyMjIyMjIyMjIyMjIyMjIyMjIyMjIyMjIyMjIyMjIyMiIsInNlbmRlciI6IjB4MzMzMzMzMzMzMzMzMzMzMzMzMzMzMzMzMzMzMzMzMzMzMzMzMzMzMyIsInN0YXR1cyI6ImNvbmZpcm1lZCIsInN1Ym1pdHRlZF9hdCI6IjIwMjYtMDgtMjhUMTI6MDA6MDQuMDAwWiIsInRyYW5zYWN0aW9uX2RpZ2VzdCI6eyJzaGEyNTYiOiJTa0xCZFBnSVJrbVF0bkowZ3UtTjYyOFN3a2xKUkVIUXVldDhMQXNkUGRNIn0sInRyYW5zYWN0aW9uX2hhc2giOiIweDExMTExMTExMTExMTExMTExMTExMTExMTExMTExMTExMTExMTExMTExMTExMTExMTExMTExMTExMTExMTExMTEifX0seyJpZCI6InNoYTI1NjpGTHlZVmdxY0ZPMjE3QlBYMlQxdWlxSkxPZ01pTU44NzlhdlQ3dktDOHJrIiwia2luZCI6ImRlY2lzaW9uIiwicGFyZW50cyI6WyJzaGEyNTY6RzFneFBucVNxTEJMQXFodHpXWmllbEF6OTVHQW9KeGRINjJ1Q2l5Z2t1ZyIsInNoYTI1NjpoV05LbEs0WWlCUG9SVEpFOVNEZTRpZG5mNmxHUGF3UUlybG9qYWVpU2g0Iiwic2hhMjU2OmlxWTZvVWI5V3BRSkhUY3YzdHFIdS04Q3UyNW5OdjdDQVhRWkRoX0huWmciXSwicHJvb2ZzIjpbXSwicmVjb3JkX3ZlcnNpb24iOiJvbmNoYWluZGlsaWdlbmNlLmFnZW50LWV2aWRlbmNlLnJlY29yZC52MCIsInN0YXRlbWVudCI6eyJhZ2VudF9yZWYiOiJzaGEyNTY6TzF6aEkxSnFEY21lS09oU3dSWlQyMGE3aUVDNzFqbEg2LTBRV2JSX0M1NCIsImRlY2lkZWRfYXQiOiIyMDI2LTA4LTI4VDEyOjAwOjAzLjAwMFoiLCJkZWNpc2lvbl9pZCI6ImRlY2lzaW9uLWNvbmZvcm1hbmNlLTAwMSIsImRlY2lzaW9uX3R5cGUiOiJwYXltZW50LWFwcHJvdmFsIiwiZXZpZGVuY2VfcmVmcyI6WyJzaGEyNTY6RzFneFBucVNxTEJMQXFodHpXWmllbEF6OTVHQW9KeGRINjJ1Q2l5Z2t1ZyJdLCJvdXRjb21lIjp7ImFwcHJvdmVkIjp0cnVlfSwicG9saWN5X2RpZ2VzdCI6eyJzaGEyNTYiOiI0VEhWMVNmTkFQTTlIVEx2X05fMGFlSW11YUZmbTlyTmVMUG04ZGtQdTR3In0sInBvbGljeV9yZWYiOiJzaGEyNTY6aXFZNm9VYjlXcFFKSFRjdjN0cUh1LThDdTI1bk52N0NBWFFaRGhfSG5aZyIsInJ1bl9yZWYiOiJzaGEyNTY6aFdOS2xLNFlpQlBvUlRKRTlTRGU0aWRuZjZsR1Bhd1FJcmxvamFlaVNoNCJ9fSx7ImlkIjoic2hhMjU2OkcxZ3hQbnFTcUxCTEFxaHR6V1ppZWxBejk1R0FvSnhkSDYydUNpeWdrdWciLCJraW5kIjoiZXZpZGVuY2UiLCJwYXJlbnRzIjpbInNoYTI1NjpoV05LbEs0WWlCUG9SVEpFOVNEZTRpZG5mNmxHUGF3UUlybG9qYWVpU2g0Il0sInByb29mcyI6W3siZGlnZXN0Ijp7InNoYTI1NiI6IlpORk1taXV4VE0zYU5GcFZqLWNtMjNCR0V2Z0REZnpnZ0VUY092Z3djVzgifSwibWVkaWFfdHlwZSI6ImFwcGxpY2F0aW9uL2pzb24iLCJwcm9vZl90eXBlIjoiZXh0ZXJuYWwtZGlnZXN0In1dLCJyZWNvcmRfdmVyc2lvbiI6Im9uY2hhaW5kaWxpZ2VuY2UuYWdlbnQtZXZpZGVuY2UucmVjb3JkLnYwIiwic3RhdGVtZW50Ijp7ImV2aWRlbmNlX3R5cGUiOiJzYW5jdGlvbnMtc2NyZWVuIiwiZXhwaXJlc19hdCI6bnVsbCwib2JzZXJ2ZWRfYXQiOiIyMDI2LTA4LTI4VDEyOjAwOjAxLjAwMFoiLCJyZXF1ZXN0Ijp7ImRpZ2VzdCI6eyJzaGEyNTYiOiJwel95UjU2SzJIdmE2OUtrZ1I0VjF0T0Z5bXlZbDdBaEgwYmJVMWF5WnVNIn0sIm1lZGlhX3R5cGUiOiJhcHBsaWNhdGlvbi9qc29uIn0sInJlc3BvbnNlIjp7ImRpZ2VzdCI6eyJzaGEyNTYiOiJaTkZNbWl1eFRNM2FORnBWai1jbTIzQkdFdmdERGZ6Z2dFVGNPdmd3Y1c4In0sIm1lZGlhX3R5cGUiOiJhcHBsaWNhdGlvbi9qc29uIiwibW9kZSI6ImVtYmVkZGVkIiwidmFsdWUiOnsic2FuY3Rpb25lZCI6ZmFsc2V9fSwicnVuX3JlZiI6InNoYTI1NjpoV05LbEs0WWlCUG9SVEpFOVNEZTRpZG5mNmxHUGF3UUlybG9qYWVpU2g0Iiwic2NvcGUiOnsiY292ZXJhZ2UiOiJvbmUgdGVzdCBhZGRyZXNzIiwicXVlcnkiOiIweDAwMDAwMDAwMDAwMDAwMDAwMDAwMDAwMDAwMDAwMDAwMDAwMDAwMDEifSwic291cmNlIjp7ImlkIjoiaHR0cHM6Ly9hcGkuZXhhbXBsZS5pbnZhbGlkIiwidHlwZSI6Imh0dHBzLWFwaSJ9LCJ0b29sIjp7Im5hbWUiOiJzY3JlZW5fd2FsbGV0IiwidmVyc2lvbiI6IjEifSwidHJ1c3RfbW9kZSI6ImFnZW50LWFzc2VydGlvbiJ9fSx7ImlkIjoic2hhMjU2OkhKZ2hUX3hIS2FDNWJTXzVINnBYYjlTSFZSbXNhMXhlWG8ydXZwVFVGcWciLCJraW5kIjoicHJpbmNpcGFsIiwicGFyZW50cyI6W10sInByb29mcyI6W10sInJlY29yZF92ZXJzaW9uIjoib25jaGFpbmRpbGlnZW5jZS5hZ2VudC1ldmlkZW5jZS5yZWNvcmQudjAiLCJzdGF0ZW1lbnQiOnsiZGlzcGxheV9uYW1lIjoiQ29uZm9ybWFuY2UgVHJlYXN1cnkiLCJwcmluY2lwYWxfaWQiOiJ1cm46b25jaGFpbmRpbGlnZW5jZTp0ZXN0OnRyZWFzdXJ5IiwicHJpbmNpcGFsX3R5cGUiOiJvcmdhbml6YXRpb24ifX0seyJpZCI6InNoYTI1NjpPMXpoSTFKcURjbWVLT2hTd1JaVDIwYTdpRUM3MWpsSDYtMFFXYlJfQzU0Iiwia2luZCI6ImFnZW50IiwicGFyZW50cyI6WyJzaGEyNTY6SEpnaFRfeEhLYUM1YlNfNUg2cFhiOVNIVlJtc2ExeGVYbzJ1dnBUVUZxZyJdLCJwcm9vZnMiOltdLCJyZWNvcmRfdmVyc2lvbiI6Im9uY2hhaW5kaWxpZ2VuY2UuYWdlbnQtZXZpZGVuY2UucmVjb3JkLnYwIiwic3RhdGVtZW50Ijp7ImFnZW50X2lkIjoidXJuOm9uY2hhaW5kaWxpZ2VuY2U6dGVzdDphZ2VudCIsImFnZW50X3ZlcnNpb24iOiIxLjAuMCIsIm9wZXJhdG9yX3JlZiI6InNoYTI1NjpISmdoVF94SEthQzViU181SDZwWGI5U0hWUm1zYTF4ZVhvMnV2cFRVRnFnIn19LHsiaWQiOiJzaGEyNTY6aFdOS2xLNFlpQlBvUlRKRTlTRGU0aWRuZjZsR1Bhd1FJcmxvamFlaVNoNCIsImtpbmQiOiJydW4iLCJwYXJlbnRzIjpbInNoYTI1NjpPMXpoSTFKcURjbWVLT2hTd1JaVDIwYTdpRUM3MWpsSDYtMFFXYlJfQzU0Iiwic2hhMjU2Om12bUg5TWRpeTRDdlZSU2RXclIyUVFRejlPYWVnNDhpdlVMR2RxVjBxU3MiXSwicHJvb2ZzIjpbXSwicmVjb3JkX3ZlcnNpb24iOiJvbmNoYWluZGlsaWdlbmNlLmFnZW50LWV2aWRlbmNlLnJlY29yZC52MCIsInN0YXRlbWVudCI6eyJhZ2VudF9yZWYiOiJzaGEyNTY6TzF6aEkxSnFEY21lS09oU3dSWlQyMGE3aUVDNzFqbEg2LTBRV2JSX0M1NCIsImVuZGVkX2F0IjoiMjAyNi0wOC0yOFQxMjowMDowNS4wMDBaIiwibWFuZGF0ZV9yZWYiOiJzaGEyNTY6bXZtSDlNZGl5NEN2VlJTZFdyUjJRUVF6OU9hZWc0OGl2VUxHZHFWMHFTcyIsInJ1bl9leHRlcm5hbF9pZCI6InJ1bi1jb25mb3JtYW5jZS0wMDEiLCJzdGFydGVkX2F0IjoiMjAyNi0wOC0yOFQxMjowMDowMC4wMDBaIn19LHsiaWQiOiJzaGEyNTY6aXFZNm9VYjlXcFFKSFRjdjN0cUh1LThDdTI1bk52N0NBWFFaRGhfSG5aZyIsImtpbmQiOiJwb2xpY3kiLCJwYXJlbnRzIjpbInNoYTI1NjpoV05LbEs0WWlCUG9SVEpFOVNEZTRpZG5mNmxHUGF3UUlybG9qYWVpU2g0Il0sInByb29mcyI6W10sInJlY29yZF92ZXJzaW9uIjoib25jaGFpbmRpbGlnZW5jZS5hZ2VudC1ldmlkZW5jZS5yZWNvcmQudjAiLCJzdGF0ZW1lbnQiOnsiZGlnZXN0Ijp7InNoYTI1NiI6IjRUSFYxU2ZOQVBNOUhUTHZfTl8wYWVJbXVhRmZtOXJOZUxQbThka1B1NHcifSwiZWZmZWN0aXZlX2Zyb20iOiIyMDI2LTA4LTI4VDAwOjAwOjAwLjAwMFoiLCJwb2xpY3kiOnsicnVsZSI6InNhbmN0aW9uZWQgbXVzdCBiZSBmYWxzZSJ9LCJwb2xpY3lfaWQiOiJ1cm46b25jaGFpbmRpbGlnZW5jZTp0ZXN0OnBvbGljeSIsInNvdXJjZSI6Imh0dHBzOi8vZXhhbXBsZS5pbnZhbGlkL3BvbGljeS8xIiwidmVyc2lvbiI6IjEifX0seyJpZCI6InNoYTI1Njptdm1IOU1kaXk0Q3ZWUlNkV3JSMlFRUXo5T2FlZzQ4aXZVTEdkcVYwcVNzIiwia2luZCI6Im1hbmRhdGUiLCJwYXJlbnRzIjpbInNoYTI1NjpISmdoVF94SEthQzViU181SDZwWGI5U0hWUm1zYTF4ZVhvMnV2cFRVRnFnIl0sInByb29mcyI6W10sInJlY29yZF92ZXJzaW9uIjoib25jaGFpbmRpbGlnZW5jZS5hZ2VudC1ldmlkZW5jZS5yZWNvcmQudjAiLCJzdGF0ZW1lbnQiOnsibGltaXRzIjp7ImFtb3VudCI6IjEwLjAwIn0sIm1hbmRhdGVfaWQiOiJtYW5kYXRlLWNvbmZvcm1hbmNlLTAwMSIsInByaW5jaXBhbF9yZWYiOiJzaGEyNTY6SEpnaFRfeEhLYUM1YlNfNUg2cFhiOVNIVlJtc2ExeGVYbzJ1dnBUVUZxZyIsInNjb3BlIjp7ImFjdGlvbiI6InBheSIsImFzc2V0IjoicGF0aFVTRCIsIm1heF9hbW91bnQiOiIxMC4wMCJ9LCJ2YWxpZF9mcm9tIjoiMjAyNi0wOC0yOFQwMDowMDowMC4wMDBaIiwidmFsaWRfdW50aWwiOiIyMDI2LTA4LTI5VDAwOjAwOjAwLjAwMFoifX1dLCJyb290X2lkcyI6WyJzaGEyNTY6LXY1UzZCaDQ4V1U2akNjaHM4UWU5OGl2Zl9BX3BkRUlHdG1jeGZNOG94SSJdLCJydW5faWQiOiJzaGEyNTY6aFdOS2xLNFlpQlBvUlRKRTlTRGU0aWRuZjZsR1Bhd1FJcmxvamFlaVNoNCJ9",
    "signatures": [
      {
        "keyid": "ed25519-3rLe053Cb84OYIW2",
        "sig": "c5QSw7HTSuaPKkYzc/FXL/9lplP5ZEceSesmhQioOqtYXRwdf6jVrnuHZ06+AnfxaFybj/s6oNz5AnZTYF/wBQ=="
      }
    ]
  },
  "verification_material": {
    "keys": [
      {
        "key_id": "ed25519-3rLe053Cb84OYIW2",
        "algorithm": "ed25519",
        "public_key_pem": "-----BEGIN PUBLIC KEY-----\nMCowBQYDK2VwAyEAPUAXw+hDiVqStwqnTRt+vJyYLM8uxJaMwM1V8Sr0Zgw=\n-----END PUBLIC KEY-----\n",
        "status": "active",
        "valid_from": "2026-08-28T00:00:00.000Z",
        "valid_until": null,
        "status_changed_at": "2026-08-28T00:00:00.000Z",
        "replacement_key_id": null,
        "compromised_at": null
      }
    ],
    "registry_snapshots": [],
    "anchors": []
  }
}
